{
  "version": "phase1.5-round1",
  "taxonomy_assignments": [
    {
      "assignment_id": "tax-oh-my-codex-agents",
      "unit_id": "unit-oh-my-codex-agents",
      "taxonomy_version": "2.1.0",
      "primary_domain": "orchestration-and-workflow",
      "hybrid_primary_members": [],
      "secondary_domains": [],
      "function_modes": ["orchestrate"],
      "industry_tags": ["software"],
      "role_tags": ["engineer"],
      "context_scope_tags": ["team"]
    },
    {
      "assignment_id": "tax-oh-my-codex-deep-interview",
      "unit_id": "unit-oh-my-codex-deep-interview",
      "taxonomy_version": "2.1.0",
      "primary_domain": "orchestration-and-workflow",
      "hybrid_primary_members": [],
      "secondary_domains": ["product-and-business-strategy"],
      "function_modes": ["plan", "orchestrate"],
      "industry_tags": ["software"],
      "role_tags": ["engineer"],
      "context_scope_tags": ["team"]
    },
    {
      "assignment_id": "tax-superpowers-brainstorming",
      "unit_id": "unit-superpowers-brainstorming",
      "taxonomy_version": "2.1.0",
      "primary_domain": "orchestration-and-workflow",
      "hybrid_primary_members": ["software-engineering", "orchestration-and-workflow"],
      "secondary_domains": [],
      "function_modes": ["plan", "orchestrate"],
      "industry_tags": ["software"],
      "role_tags": ["engineer"],
      "context_scope_tags": ["team"]
    },
    {
      "assignment_id": "tax-superpowers-tdd",
      "unit_id": "unit-superpowers-tdd",
      "taxonomy_version": "2.1.0",
      "primary_domain": "software-engineering",
      "hybrid_primary_members": [],
      "secondary_domains": [],
      "function_modes": ["implement", "verify"],
      "industry_tags": ["software"],
      "role_tags": ["engineer"],
      "context_scope_tags": ["team"]
    },
    {
      "assignment_id": "tax-claude-content-writer",
      "unit_id": "unit-claude-agents-content-writer",
      "taxonomy_version": "2.1.0",
      "primary_domain": "writing-voice-and-content",
      "hybrid_primary_members": [],
      "secondary_domains": [],
      "function_modes": ["implement"],
      "industry_tags": [],
      "role_tags": ["writer"],
      "context_scope_tags": ["team"]
    },
    {
      "assignment_id": "tax-ralph-prd",
      "unit_id": "unit-ralph-prd",
      "taxonomy_version": "2.1.0",
      "primary_domain": "product-and-business-strategy",
      "hybrid_primary_members": [],
      "secondary_domains": ["orchestration-and-workflow"],
      "function_modes": ["plan"],
      "industry_tags": ["software"],
      "role_tags": ["founder", "engineer"],
      "context_scope_tags": ["team"]
    },
    {
      "assignment_id": "tax-matt-tdd",
      "unit_id": "unit-mattpocock-tdd",
      "taxonomy_version": "2.1.0",
      "primary_domain": "software-engineering",
      "hybrid_primary_members": [],
      "secondary_domains": [],
      "function_modes": ["implement", "verify"],
      "industry_tags": ["software"],
      "role_tags": ["engineer"],
      "context_scope_tags": ["team"]
    },
    {
      "assignment_id": "tax-marketing-product-context",
      "unit_id": "unit-marketing-product-context",
      "taxonomy_version": "2.1.0",
      "primary_domain": "marketing-and-growth",
      "hybrid_primary_members": [],
      "secondary_domains": ["writing-voice-and-content"],
      "function_modes": ["research", "plan"],
      "industry_tags": ["software"],
      "role_tags": ["marketer", "founder"],
      "context_scope_tags": ["team"]
    },
    {
      "assignment_id": "tax-marketing-page-cro",
      "unit_id": "unit-marketing-page-cro",
      "taxonomy_version": "2.1.0",
      "primary_domain": "marketing-and-growth",
      "hybrid_primary_members": [],
      "secondary_domains": ["data-and-analytics"],
      "function_modes": ["audit"],
      "industry_tags": ["software", "ecommerce"],
      "role_tags": ["marketer"],
      "context_scope_tags": ["team", "consumer"]
    },
    {
      "assignment_id": "tax-lago-template",
      "unit_id": "unit-lago-voice-template",
      "taxonomy_version": "2.1.0",
      "primary_domain": "writing-voice-and-content",
      "hybrid_primary_members": [],
      "secondary_domains": [],
      "function_modes": ["template", "rewrite"],
      "industry_tags": [],
      "role_tags": ["founder", "writer"],
      "context_scope_tags": ["personal", "team"]
    },
    {
      "assignment_id": "tax-taste-main",
      "unit_id": "unit-taste-main",
      "taxonomy_version": "2.1.0",
      "primary_domain": "design-and-ux",
      "hybrid_primary_members": [],
      "secondary_domains": [],
      "function_modes": ["implement", "review"],
      "industry_tags": ["software"],
      "role_tags": ["designer", "engineer"],
      "context_scope_tags": ["consumer"]
    },
    {
      "assignment_id": "tax-taste-redesign",
      "unit_id": "unit-taste-redesign",
      "taxonomy_version": "2.1.0",
      "primary_domain": "design-and-ux",
      "hybrid_primary_members": [],
      "secondary_domains": [],
      "function_modes": ["audit", "implement"],
      "industry_tags": ["software"],
      "role_tags": ["designer", "engineer"],
      "context_scope_tags": ["consumer"]
    },
    {
      "assignment_id": "tax-impeccable-main",
      "unit_id": "unit-impeccable-main",
      "taxonomy_version": "2.1.0",
      "primary_domain": "design-and-ux",
      "hybrid_primary_members": [],
      "secondary_domains": [],
      "function_modes": ["audit", "review", "implement"],
      "industry_tags": ["software"],
      "role_tags": ["designer", "engineer"],
      "context_scope_tags": ["team", "consumer"]
    },
    {
      "assignment_id": "tax-impeccable-agents",
      "unit_id": "unit-impeccable-agents",
      "taxonomy_version": "2.1.0",
      "primary_domain": "meta-skillcraft-and-tooling",
      "hybrid_primary_members": [],
      "secondary_domains": ["design-and-ux"],
      "function_modes": ["package"],
      "industry_tags": ["software"],
      "role_tags": ["maintainer"],
      "context_scope_tags": ["team"]
    }
  ],
  "tag_assignments": [
    { "tag_assignment_id": "tag-src-oh-my-codex", "subject_type": "source", "subject_id": "src-oh-my-codex", "tag_family": "source", "tag_id": "source:oh-my-codex", "tag_label": "oh-my-codex", "assignment_evidence_type": "E", "assignment_basis": "Source origin and name." },
    { "tag_assignment_id": "tag-src-superpowers", "subject_type": "source", "subject_id": "src-superpowers", "tag_family": "source", "tag_id": "source:superpowers", "tag_label": "superpowers", "assignment_evidence_type": "E", "assignment_basis": "Source origin and name." },
    { "tag_assignment_id": "tag-src-claude-agents", "subject_type": "source", "subject_id": "src-claude-agents", "tag_family": "source", "tag_id": "source:claude-agents", "tag_label": "claude-agents", "assignment_evidence_type": "E", "assignment_basis": "Source origin and name." },
    { "tag_assignment_id": "tag-src-ralph", "subject_type": "source", "subject_id": "src-ralph", "tag_family": "source", "tag_id": "source:ralph", "tag_label": "ralph", "assignment_evidence_type": "E", "assignment_basis": "Source origin and name." },
    { "tag_assignment_id": "tag-src-matt", "subject_type": "source", "subject_id": "src-mattpocock-skills", "tag_family": "source", "tag_id": "source:mattpocock-skills", "tag_label": "mattpocock/skills", "assignment_evidence_type": "E", "assignment_basis": "Source origin and name." },
    { "tag_assignment_id": "tag-src-marketing", "subject_type": "source", "subject_id": "src-marketingskills", "tag_family": "source", "tag_id": "source:marketingskills", "tag_label": "marketingskills", "assignment_evidence_type": "E", "assignment_basis": "Source origin and name." },
    { "tag_assignment_id": "tag-src-lago", "subject_type": "source", "subject_id": "src-inside-lago-voice-skill", "tag_family": "source", "tag_id": "source:inside-lago-voice-skill", "tag_label": "inside-lago-voice-skill", "assignment_evidence_type": "E", "assignment_basis": "Source origin and name." },
    { "tag_assignment_id": "tag-src-taste", "subject_type": "source", "subject_id": "src-taste-skill", "tag_family": "source", "tag_id": "source:taste-skill", "tag_label": "taste-skill", "assignment_evidence_type": "E", "assignment_basis": "Source origin and name." },
    { "tag_assignment_id": "tag-src-impeccable", "subject_type": "source", "subject_id": "src-impeccable", "tag_family": "source", "tag_id": "source:impeccable", "tag_label": "impeccable", "assignment_evidence_type": "E", "assignment_basis": "Source origin and name." },

    { "tag_assignment_id": "tag-unit-ohmy-runtime", "subject_type": "unit", "subject_id": "unit-oh-my-codex-deep-interview", "tag_family": "runtime", "tag_id": "runtime:codex", "tag_label": "Codex", "assignment_evidence_type": "E", "assignment_basis": "Repo explicitly targets Codex." },
    { "tag_assignment_id": "tag-unit-super-runtime", "subject_type": "unit", "subject_id": "unit-superpowers-brainstorming", "tag_family": "runtime", "tag_id": "runtime:codex", "tag_label": "Codex", "assignment_evidence_type": "E", "assignment_basis": "Repo explicitly targets Codex." },
    { "tag_assignment_id": "tag-unit-super-tdd-runtime", "subject_type": "unit", "subject_id": "unit-superpowers-tdd", "tag_family": "runtime", "tag_id": "runtime:codex", "tag_label": "Codex", "assignment_evidence_type": "E", "assignment_basis": "Repo explicitly targets Codex." },
    { "tag_assignment_id": "tag-unit-marketing-runtime", "subject_type": "unit", "subject_id": "unit-marketing-product-context", "tag_family": "runtime", "tag_id": "runtime:codex", "tag_label": "Codex", "assignment_evidence_type": "E", "assignment_basis": "Repo explicitly targets Codex." },